{
  "$schema": "./phase-3-execution-plan.schema.json",
  "planId": "tourify-music-phase-3",
  "version": "1.0.0-template",
  "status": "audit_required",
  "repository": {
    "commit": "AUDIT_REQUIRED",
    "branch": "AUDIT_REQUIRED"
  },
  "hardRules": [
    "never_reset_database",
    "artist_music_remains_canonical",
    "issued_historical_rights_snapshots_only",
    "integer_or_rational_money_math",
    "immutable_source_and_posted_ledger",
    "no_open_secondary_market",
    "regulated_finance_partner_gated",
    "valuation_separate_from_rights_and_accounting",
    "feature_flag_every_new_surface"
  ],
  "stages": [
    {
      "id": "P3-00",
      "name": "Audit, governance, and compliance decisions",
      "status": "not_started",
      "tasks": [
        {
          "id": "P3-00-T01",
          "title": "Read canonical Phase 1-3 documents",
          "status": "not_started",
          "dependencies": [],
          "scope": "Replace with audited repository paths and implementation notes.",
          "acceptanceCriteria": [
            "Implementation matches the applicable Phase 3 documents.",
            "Focused tests pass.",
            "Evidence is recorded in this task."
          ],
          "evidence": [],
          "blockers": [],
          "filesChanged": [],
          "tests": []
        },
        {
          "id": "P3-00-T02",
          "title": "Audit current repository and deployed schema assumptions",
          "status": "not_started",
          "dependencies": [
            "P3-00-T01"
          ],
          "scope": "Replace with audited repository paths and implementation notes.",
          "acceptanceCriteria": [
            "Implementation matches the applicable Phase 3 documents.",
            "Focused tests pass.",
            "Evidence is recorded in this task."
          ],
          "evidence": [],
          "blockers": [],
          "filesChanged": [],
          "tests": []
        },
        {
          "id": "P3-00-T03",
          "title": "Capture regression baseline",
          "status": "not_started",
          "dependencies": [
            "P3-00-T02"
          ],
          "scope": "Replace with audited repository paths and implementation notes.",
          "acceptanceCriteria": [
            "Implementation matches the applicable Phase 3 documents.",
            "Focused tests pass.",
            "Evidence is recorded in this task."
          ],
          "evidence": [],
          "blockers": [],
          "filesChanged": [],
          "tests": []
        },
        {
          "id": "P3-00-T04",
          "title": "Map payment and marketplace roles",
          "status": "not_started",
          "dependencies": [
            "P3-00-T03"
          ],
          "scope": "Replace with audited repository paths and implementation notes.",
          "acceptanceCriteria": [
            "Implementation matches the applicable Phase 3 documents.",
            "Focused tests pass.",
            "Evidence is recorded in this task."
          ],
          "evidence": [],
          "blockers": [],
          "filesChanged": [],
          "tests": []
        },
        {
          "id": "P3-00-T05",
          "title": "Document accounting and legal entity boundaries",
          "status": "not_started",
          "dependencies": [
            "P3-00-T04"
          ],
          "scope": "Replace with audited repository paths and implementation notes.",
          "acceptanceCriteria": [
            "Implementation matches the applicable Phase 3 documents.",
            "Focused tests pass.",
            "Evidence is recorded in this task."
          ],
          "evidence": [],
          "blockers": [],
          "filesChanged": [],
          "tests": []
        },
        {
          "id": "P3-00-T06",
          "title": "Record tax and sanctions decisions",
          "status": "not_started",
          "dependencies": [
            "P3-00-T05"
          ],
          "scope": "Replace with audited repository paths and implementation notes.",
          "acceptanceCriteria": [
            "Implementation matches the applicable Phase 3 documents.",
            "Focused tests pass.",
            "Evidence is recorded in this task."
          ],
          "evidence": [],
          "blockers": [],
          "filesChanged": [],
          "tests": []
        },
        {
          "id": "P3-00-T07",
          "title": "Create ADRs and feature flags",
          "status": "not_started",
          "dependencies": [
            "P3-00-T06"
          ],
          "scope": "Replace with audited repository paths and implementation notes.",
          "acceptanceCriteria": [
            "Implementation matches the applicable Phase 3 documents.",
            "Focused tests pass.",
            "Evidence is recorded in this task."
          ],
          "evidence": [],
          "blockers": [],
          "filesChanged": [],
          "tests": []
        },
        {
          "id": "P3-00-T08",
          "title": "Validate repository-specific execution plan",
          "status": "not_started",
          "dependencies": [
            "P3-00-T07"
          ],
          "scope": "Replace with audited repository paths and implementation notes.",
          "acceptanceCriteria": [
            "Implementation matches the applicable Phase 3 documents.",
            "Focused tests pass.",
            "Evidence is recorded in this task."
          ],
          "evidence": [],
          "blockers": [],
          "filesChanged": [],
          "tests": []
        }
      ]
    },
    {
      "id": "P3-01",
      "name": "Royalty source ingestion",
      "status": "not_started",
      "tasks": [
        {
          "id": "P3-01-T01",
          "title": "Select pilot statement formats",
          "status": "not_started",
          "dependencies": [
            "P3-00-T08"
          ],
          "scope": "Replace with audited repository paths and implementation notes.",
          "acceptanceCriteria": [
            "Implementation matches the applicable Phase 3 documents.",
            "Focused tests pass.",
            "Evidence is recorded in this task."
          ],
          "evidence": [],
          "blockers": [],
          "filesChanged": [],
          "tests": []
        },
        {
          "id": "P3-01-T02",
          "title": "Create private statement storage workflow",
          "status": "not_started",
          "dependencies": [
            "P3-01-T01"
          ],
          "scope": "Replace with audited repository paths and implementation notes.",
          "acceptanceCriteria": [
            "Implementation matches the applicable Phase 3 documents.",
            "Focused tests pass.",
            "Evidence is recorded in this task."
          ],
          "evidence": [],
          "blockers": [],
          "filesChanged": [],
          "tests": []
        },
        {
          "id": "P3-01-T03",
          "title": "Implement import-batch domain",
          "status": "not_started",
          "dependencies": [
            "P3-01-T02"
          ],
          "scope": "Replace with audited repository paths and implementation notes.",
          "acceptanceCriteria": [
            "Implementation matches the applicable Phase 3 documents.",
            "Focused tests pass.",
            "Evidence is recorded in this task."
          ],
          "evidence": [],
          "blockers": [],
          "filesChanged": [],
          "tests": []
        },
        {
          "id": "P3-01-T04",
          "title": "Add source hashing and duplicate detection",
          "status": "not_started",
          "dependencies": [
            "P3-01-T03"
          ],
          "scope": "Replace with audited repository paths and implementation notes.",
          "acceptanceCriteria": [
            "Implementation matches the applicable Phase 3 documents.",
            "Focused tests pass.",
            "Evidence is recorded in this task."
          ],
          "evidence": [],
          "blockers": [],
          "filesChanged": [],
          "tests": []
        },
        {
          "id": "P3-01-T05",
          "title": "Build parser adapter interface",
          "status": "not_started",
          "dependencies": [
            "P3-01-T04"
          ],
          "scope": "Replace with audited repository paths and implementation notes.",
          "acceptanceCriteria": [
            "Implementation matches the applicable Phase 3 documents.",
            "Focused tests pass.",
            "Evidence is recorded in this task."
          ],
          "evidence": [],
          "blockers": [],
          "filesChanged": [],
          "tests": []
        },
        {
          "id": "P3-01-T06",
          "title": "Implement first provider parser",
          "status": "not_started",
          "dependencies": [
            "P3-01-T05"
          ],
          "scope": "Replace with audited repository paths and implementation notes.",
          "acceptanceCriteria": [
            "Implementation matches the applicable Phase 3 documents.",
            "Focused tests pass.",
            "Evidence is recorded in this task."
          ],
          "evidence": [],
          "blockers": [],
          "filesChanged": [],
          "tests": []
        },
        {
          "id": "P3-01-T07",
          "title": "Implement DDEX DSR adapter or documented defer decision",
          "status": "not_started",
          "dependencies": [
            "P3-01-T06"
          ],
          "scope": "Replace with audited repository paths and implementation notes.",
          "acceptanceCriteria": [
            "Implementation matches the applicable Phase 3 documents.",
            "Focused tests pass.",
            "Evidence is recorded in this task."
          ],
          "evidence": [],
          "blockers": [],
          "filesChanged": [],
          "tests": []
        },
        {
          "id": "P3-01-T08",